,movie,overview,preprocessed
130,Меня зовут Кхан ,Ризван Кхан; мусульманин из Индии; переезжает в Сан-Франциско и живет со своим братом и невесткой. Ризван; страдающий от Синдрома Аспергера; влюбляется в Мандиру. Несмотря на протесты его семьи; они женятся и начинают вместе небольшой бизнес. Они живут счастливо до 11 сентября 2001 года; когда отношение к мусульманам резко меняется. Когда происходит трагедия; Мандира оказывается раздавленной и их отношения дают трещину. Ризван растерян и очень расстроен тем; что любовь всей его жизни покинула его. Чтобы вернуть ее; он предпринимает трогательное и вдохновляющее путешествие через всю Америку.,"['ризва', 'кхан', 'мусульманин', 'инд', 'переезжа', 'сан', 'франциск', 'живет', 'сво', 'брат', 'невестк', 'ризва', 'страда', 'синдром', 'аспергер', 'влюбля', 'мандир', 'несмотр', 'протест', 'сем', 'жен', 'начина', 'вмест', 'небольш', 'бизнес', 'живут', 'счастлив', 'сентябр', 'отношен', 'мусульман', 'резк', 'меня', 'происход', 'трагед', 'мандир', 'оказыва', 'раздавлен', 'отношен', 'дают', 'трещин', 'ризва', 'растеря', 'расстро', 'любов', 'все', 'жизн', 'покинул', 'вернут', 'предпринима', 'трогательн', 'вдохновля', 'путешеств', 'америк']"
131,Афера ,В 1930-е годы двое отпетых мошенников пытаются отомстить главарю мафии за смерть их общего друга с помощью одной из самых неожиданных афер в истории кино; которая к тому же заканчивается удивительным и забавным образом.,"['год', 'дво', 'отпет', 'мошенник', 'пыта', 'отомст', 'главар', 'маф', 'смерт', 'общ', 'друг', 'помощ', 'сам', 'неожида', 'афер', 'истор', 'кин', 'заканчива', 'удивительн', 'забавн', 'образ']"
132,Привидение ,Влюблённая пара Сэм и Молли возвращается домой после приятного вечера; когда на них нападает грабитель. Защищаясь; Сэм погибает и становится призраком. Он узнаёт; что его смерть не была случайной; а над его возлюбленной нависла смертельная опасность. Чтобы предупредить Молли; Сэм начинает обход практикующих медиумов и; о чудо! — находит женщину; которая действительно может его слышать. Только вот сама она не горит желанием помогать назойливому привидению.,"['влюблен', 'пар', 'сэм', 'молл', 'возвраща', 'дом', 'приятн', 'вечер', 'напада', 'грабител', 'защищ', 'сэм', 'погиба', 'станов', 'призрак', 'узна', 'смерт', 'случайн', 'возлюблен', 'нависл', 'смертельн', 'опасн', 'предупред', 'молл', 'сэм', 'начина', 'обход', 'практик', 'медиум', 'чуд', 'наход', 'женщин', 'слыша', 'гор', 'желан', 'помога', 'назойлив', 'привиден']"
133,Танцующий с волками ,США во времена Гражданской войны. Лейтенант Джон Данбар после ранения в бою просит перевести его на новое место службы ближе к западной границе США. Новое место его службы — отдалённый маленький форт. Командир покончил жизнь самоубийством; а попутчик Данбара погиб в стычке с индейцами после того; как довез лейтенанта до места назначения. Людей; знающих; что Данбар остался один в форте и должен выжить в условиях суровой природы и в соседстве с кажущимися негостеприимными коренными обитателями Северной Америки; просто не осталось. Постепенно лейтенант осваивается и заводит дружбу с индейцами.,"['сша', 'врем', 'гражданск', 'войн', 'лейтенант', 'джон', 'данбар', 'ранен', 'бо', 'прос', 'перевест', 'нов', 'мест', 'служб', 'ближ', 'западн', 'границ', 'сша', 'нов', 'мест', 'служб', 'отдален', 'маленьк', 'форт', 'командир', 'поконч', 'самоубийств', 'попутчик', 'данбар', 'погиб', 'стычк', 'индейц', 'довез', 'лейтенант', 'мест', 'назначен', 'люд', 'знающ', 'данбар', 'оста', 'форт', 'долж', 'выж', 'услов', 'суров', 'природ', 'соседств', 'кажущ', 'негостеприимн', 'корен', 'обитател', 'северн', 'америк', 'оста', 'постепен', 'лейтенант', 'осваива', 'завод', 'дружб', 'индейц']"
134,12 стульев ,Во время революции и последовавшего за ней краткого периода военного коммунизма многие прятали свои ценности как можно надежнее. И вот Ипполит Матвеевич Воробьянинов; бывший Старгородский предводитель дворянства и светский лев; а ныне — скромный делопроизводитель ЗАГСа; узнает от умирающей тещи; что некогда она спрятала свои бриллианты и жемчуга в общей сложности на 150 000 золотых рублей под обивку одного из двенадцати стульев гостиного гарнитура работы известного мастера Гамбса.Бросив все; Воробьянинов бросается на поиски стульев; в чем ему; конечно же; небескорыстно; берется помочь молодой авантюрист; «великий комбинатор» Остап Бендер. Найти следы разрозненного гарнитура непросто. Не облегчает положения и то; что перед смертью теща Воробьянинова открыла тайну сокровищ и своему исповеднику; отцу Федору; всю жизнь мечтавшему о собственном свечном заводике в Самаре…,"['революц', 'последова', 'кратк', 'период', 'воен', 'коммунизм', 'мног', 'прята', 'ценност', 'надежн', 'иппол', 'матвеевич', 'воробьянин', 'бывш', 'старгородск', 'предводител', 'дворянств', 'светск', 'лев', 'нын', 'скромн', 'делопроизводител', 'загс', 'узна', 'умира', 'тещ', 'некогд', 'спрята', 'бриллиант', 'жемчуг', 'общ', 'сложност', 'золот', 'рубл', 'обивк', 'двенадцат', 'стул', 'гостин', 'гарнитур', 'работ', 'известн', 'мастер', 'гамбс', 'брос', 'воробьянин', 'броса', 'поиск', 'стул', 'небескорыстн', 'берет', 'помоч', 'молод', 'авантюрист', 'велик', 'комбинатор', 'остап', 'бендер', 'найт', 'след', 'разрознен', 'гарнитур', 'непрост', 'облегча', 'положен', 'смерт', 'тещ', 'воробьянинов', 'откр', 'тайн', 'сокровищ', 'сво', 'исповедник', 'отц', 'федор', 'мечта', 'собствен', 'свечн', 'заводик', 'самар']"
135,Жизнь Дэвида Гейла ,Дэвид Гейл — человек; который пробовал жить в соответствии со своими принципами; но; в причудливом повороте судьбы; этот преданный отец; популярный профессор и ярый противник смертной казни окажется в камере смертников за убийство активистки Констанции Харравей. За три дня до исполнения приговора Гейл соглашается дать интервью репортеру Битси Блум.Но журналистка вскоре понимает; что ее участие в этом деле не ограничится одним интервью и что жизнь человека находится в ее руках. Поставив на кон свою собственную безопасность; она начинает расследовать те ужасные события; которые окружали смерть Констанции.,"['дэвид', 'гейл', 'пробова', 'жит', 'соответств', 'сво', 'принцип', 'причудлив', 'поворот', 'судьб', 'преда', 'отец', 'популярн', 'профессор', 'яр', 'противник', 'смертн', 'казн', 'окажет', 'камер', 'смертник', 'убийств', 'активистк', 'констанц', 'харрав', 'дня', 'исполнен', 'приговор', 'гейл', 'соглаша', 'дат', 'интерв', 'репортер', 'битс', 'блум', 'журналистк', 'вскор', 'понима', 'участ', 'дел', 'огранич', 'одн', 'интерв', 'человек', 'наход', 'рук', 'постав', 'кон', 'собствен', 'безопасн', 'начина', 'расследова', 'ужасн', 'событ', 'окружа', 'смерт', 'констанц']"
136,Рэй ,История жизни великого американского музыканта Рэя Чарльза. Нищее детство; потеря брата; ранняя слепота; наркотики; женщины; 12 детей; борьба с расизмом; а также незаурядный талант; блестящая карьера и настоящая революция в музыке.,"['истор', 'жизн', 'велик', 'американск', 'музыкант', 'рэ', 'чарльз', 'нищ', 'детств', 'потер', 'брат', 'ран', 'слепот', 'наркотик', 'женщин', 'дет', 'борьб', 'расизм', 'незаурядн', 'талант', 'блестя', 'карьер', 'настоя', 'революц', 'музык']"
137,Шерлок Холмс и доктор Ватсон: Сокровища Агры ,Здесь есть все — таинственные обстоятельства убийства; сверкающие драгоценности; колоритнейшие фигуры. Но главное — в ходе расследования доктор Ватсон встречает женщину; с которой; быть может; надолго свяжет свою жизнь…,"['таинствен', 'обстоятельств', 'убийств', 'сверка', 'драгоцен', 'колоритн', 'фигур', 'главн', 'ход', 'расследован', 'доктор', 'ватсон', 'встреча', 'женщин', 'надолг', 'свяжет']"
138,Терминал ,Фильм рассказывает историю Виктора Наворски; отправившегося в Нью-Йорк из Восточной Европы. Пока Виктор летел в самолете; на его родине произошел государственный переворот. Оказавшись в международном аэропорту имени Джона Кеннеди с паспортом ниоткуда; он не имеет права въехать в Соединенные Штаты и должен коротать свои дни и ночи на скамейках у выхода 67; пока война в его родной стране не закончится.Тянутся недели и месяцы; и Виктор обнаруживает; что небольшой мирок терминала может быть наполнен абсурдом; щедростью; амбициями; развлечениями; желанием сохранить свой статус; интуитивной прозорливостью и даже любовью к очаровательной стюардессе Амелии. Виктору удается завоевать симпатии всех; кроме одного человека — чиновника аэропорта Фрэнка Диксона; который считает его бюрократической ошибкой; проблемой; которую он не может контролировать; но от которой жаждет избавиться.,"['фильм', 'рассказыва', 'истор', 'виктор', 'наворск', 'отправ', 'нью', 'йорк', 'восточн', 'европ', 'виктор', 'летел', 'самолет', 'родин', 'произошел', 'государствен', 'переворот', 'оказа', 'международн', 'аэропорт', 'имен', 'джон', 'кеннед', 'паспорт', 'ниоткуд', 'имеет', 'прав', 'въеха', 'соединен', 'штат', 'долж', 'корота', 'дни', 'ноч', 'скамейк', 'выход', 'войн', 'родн', 'стран', 'законч', 'тянут', 'недел', 'месяц', 'виктор', 'обнаружива', 'небольш', 'мирок', 'термина', 'наполн', 'абсурд', 'щедрост', 'амбиц', 'развлечен', 'желан', 'сохран', 'сво', 'статус', 'интуитивн', 'прозорлив', 'любов', 'очаровательн', 'стюардесс', 'амел', 'виктор', 'уда', 'завоева', 'симпат', 'человек', 'чиновник', 'аэропорт', 'фрэнк', 'диксон', 'счита', 'бюрократическ', 'ошибк', 'проблем', 'котор', 'контролирова', 'жаждет', 'избав']"
139,Самый быстрый Indian ,История жизни знаменитого новозеландца Берта Монро; который потратил десятилетия жизни на переоснащение своего любимого мотоцикла марки «Индиан» 1920 года выпуска с максимальной скоростью в 58 миль/ч в гоночный болид для установления рекорда скорости.,"['истор', 'жизн', 'знаменит', 'новозеландц', 'берт', 'монр', 'потрат', 'десятилет', 'жизн', 'переоснащен', 'любим', 'мотоцикл', 'марк', 'индиа', 'выпуск', 'максимальн', 'скорост', 'мил', 'гоночн', 'болид', 'установлен', 'рекорд', 'скорост']"
140,Назад в будущее 3 ,Из газет 1955 года Марти узнает; что доктор Браун погиб еще сто лет назад. Несмотря на просьбы Дока не навещать его в XIX веке; Марти вновь хочет вмешаться в ход событий и на машине времени уносится в 1885 год; навстречу Дикому Западу. Это путешествие; как и все прежние; не обходится без опасных приключений; но смелый Марти; рискуя жизнью; предотвращает трагедию в жизни Эммета Брауна. Тот; в свою очередь; без памяти влюбляется в очаровательную незнакомку; которую спасает от гибели; и поездка домой — в будущее — теряет для него всякий смысл…,"['газет', 'март', 'узна', 'доктор', 'браун', 'погиб', 'сто', 'несмотр', 'просьб', 'док', 'навеща', 'xix', 'век', 'март', 'внов', 'хочет', 'вмеша', 'ход', 'событ', 'машин', 'унос', 'навстреч', 'дик', 'запад', 'путешеств', 'прежн', 'обход', 'опасн', 'приключен', 'смел', 'март', 'риску', 'жизн', 'предотвраща', 'трагед', 'жизн', 'эммет', 'браун', 'очеред', 'памят', 'влюбля', 'очаровательн', 'незнакомк', 'котор', 'спаса', 'гибел', 'поездк', 'дом', 'будущ', 'теря', 'всяк', 'смысл']"
141,Умница Уилл Хантинг ,Уилл Хантинг — 20-летний вундеркинд из Бостона; который то и дело ввязывается в неприятные истории. И когда полиция арестовывает его за очередную драку; профессор математики берет его под свою опеку; но при одном условии: Уилл должен пройти курс психотерапии. Сеансы «перевоспитания»; начавшиеся с недоверия; постепенно перерастают в дружбу между Уиллом и его наставником.,"['уилл', 'хантинг', 'летн', 'вундеркинд', 'бостон', 'дел', 'ввязыва', 'неприятн', 'истор', 'полиц', 'арестовыва', 'очередн', 'драк', 'профессор', 'математик', 'берет', 'опек', 'одн', 'услов', 'уилл', 'долж', 'пройт', 'курс', 'психотерап', 'сеанс', 'перевоспитан', 'нача', 'недовер', 'постепен', 'перераста', 'дружб', 'уилл', 'наставник']"
142,Славные парни ,История о Генри Хилле — начинающем гангстере; занимающемся грабежами вместе с подельниками Джими Конвеем и Томми Де Вито; которые с легкостью убивают любого; кто встаёт у них на пути.,"['истор', 'генр', 'хилл', 'начина', 'гангстер', 'занима', 'грабеж', 'вмест', 'подельник', 'джим', 'конве', 'томм', 'вит', 'легкост', 'убива', 'люб', 'встает', 'пут']"
143,Пираты Карибского моря: Сундук мертвеца ,Вновь оказавшись в ирреальном мире; лихой капитан Джек Воробей неожиданно узнает; что является должником легендарного капитана «Летучего Голландца» Дэйви Джонса. Джек должен в кратчайшие сроки решить эту проблему; иначе ему грозит вечное проклятие и рабское существование после смерти. Вдобавок ко всему; срывается свадьба Уилла Тернера и Элизабет Суонн; которые вынуждены составить Джеку компанию в его злоключениях…,"['внов', 'оказа', 'ирреальн', 'мир', 'лих', 'капита', 'джек', 'вороб', 'неожида', 'узна', 'явля', 'должник', 'легендарн', 'капита', 'летуч', 'голландц', 'дэйв', 'джонс', 'джек', 'долж', 'кратчайш', 'срок', 'реш', 'пробл', 'инач', 'гроз', 'вечн', 'проклят', 'рабск', 'существован', 'смерт', 'вдобавок', 'срыва', 'свадьб', 'уилл', 'тернер', 'элизабет', 'суон', 'вынужд', 'состав', 'джек', 'компан', 'злоключен']"
144,Лицо со шрамом ,Весной 1980 года был открыт порт Мэйриэл Харбор; и тысячи кубинских беженцев ринулись в Соединенные Штаты на поиски Американской Мечты. Один из них нашел ее на залитых солнцем улицах Майами. Богатство; власть и страсть превзошли даже самые невероятные его мечты. Его звали Тони Монтана. Мир запомнил его под другим именем — «Лицо со шрамом»…,"['весн', 'откр', 'порт', 'мэйриэл', 'харбор', 'тысяч', 'кубинск', 'беженц', 'ринул', 'соединен', 'штат', 'поиск', 'американск', 'мечт', 'нашел', 'залит', 'солнц', 'улиц', 'май', 'богатств', 'власт', 'страст', 'превзошл', 'сам', 'невероятн', 'мечт', 'звал', 'тон', 'монта', 'мир', 'запомн', 'друг', 'имен', 'лиц', 'шрам']"
145,На несколько долларов больше ,Заработать несколько лишних долларов честным путем на диком Западе не проблема; если у тебя есть проверенный кольт и разрешение властей на отстрел бандитов. Этим путем и идут бок о бок профессиональные охотники за головами негодяев «Человек без имени» и полковник Мортимер; общая цель которых — преступная банда мексиканца Индио.,"['заработа', 'лишн', 'доллар', 'честн', 'пут', 'дик', 'запад', 'проблем', 'проверен', 'кольт', 'разрешен', 'власт', 'отстрел', 'бандит', 'пут', 'идут', 'бок', 'бок', 'профессиональн', 'охотник', 'голов', 'негодя', 'имен', 'полковник', 'мортимер', 'общ', 'цел', 'преступн', 'банд', 'мексиканц', 'инд']"
