,movie,overview,preprocessed
63,Игра ,Николас Ван Ортон — само воплощение успеха. Он преуспевает; он невозмутим и спокоен; привык держать любую ситуацию под контролем. На день рождения Николас получает необычный подарок — билет для участия в «Игре».Ему обещают; что игра вернет яркие чувства; позволит ощутить вкус и остроту жизни. Вступив в игру; Николас начинает осознавать; что это игра всерьез; игра не на жизнь; а на смерть.,"['николас', 'ван', 'ортон', 'воплощен', 'успех', 'преуспева', 'невозмут', 'споко', 'привык', 'держа', 'люб', 'ситуац', 'контрол', 'рожден', 'николас', 'получа', 'необычн', 'подарок', 'билет', 'участ', 'игр', 'обеща', 'игр', 'вернет', 'ярк', 'чувств', 'позвол', 'ощут', 'вкус', 'острот', 'жизн', 'вступ', 'игр', 'николас', 'начина', 'осознава', 'игр', 'всерьез', 'игр', 'смерт']"
64,Храброе сердце ,Действие фильма начинается в 1280 году в Шотландии. Это история легендарного национального героя Уильяма Уоллеса; посвятившего себя борьбе с англичанами при короле Эдварде Длинноногом.Он рано лишился отца; погибшего от рук англичан; и его забрал к себе дядя Оргайл; который дал ему хорошее образование в Европе. На родину Уильям возвращается уже взрослым человеком; мечтающим завести семью и жить мирной жизнью.Но судьба распорядилась иначе. Его невесту убили англичане; и он начал свой крестовый поход за свободу.,"['действ', 'фильм', 'начина', 'шотланд', 'истор', 'легендарн', 'национальн', 'геро', 'уильям', 'уоллес', 'посвят', 'борьб', 'англичан', 'корол', 'эдвард', 'длинноног', 'лиш', 'отц', 'погибш', 'рук', 'англича', 'забра', 'дяд', 'оргайл', 'дал', 'хорош', 'образован', 'европ', 'родин', 'уил', 'возвраща', 'взросл', 'человек', 'мечта', 'завест', 'сем', 'жит', 'мирн', 'жизн', 'судьб', 'распоряд', 'инач', 'невест', 'уб', 'англичан', 'нача', 'сво', 'крестов', 'поход', 'свобод']"
65,Шерлок Холмс и доктор Ватсон: Знакомство ,Молодой доктор по фамилии Ватсон возвратился из Афганистана в родной туманный Лондон. Ему нужно недорогое жилье. И вот; по совету друга; он поселяется в маленьком домике на Бейкер-стрит. Его хозяйка — милая чудаковатая старушка миссис Хадсон. Также там имеется сосед — некий мистер Шерлок Холмс. Это непонятная и таинственная личность — к нему в гости приходят оборванцы и бандиты; а иногда полицейские и лорды. Кто же он? Доктор в растерянности…,"['молод', 'доктор', 'фамил', 'ватсон', 'возврат', 'афганиста', 'родн', 'тума', 'лондон', 'недорог', 'жил', 'совет', 'друг', 'поселя', 'маленьк', 'домик', 'бейкер', 'стрит', 'хозяйк', 'мил', 'чудаковат', 'старушк', 'миссис', 'хадсон', 'имеет', 'сосед', 'нек', 'мистер', 'шерлок', 'холмс', 'непонятн', 'таинствен', 'личност', 'гост', 'приход', 'оборванц', 'бандит', 'полицейск', 'лорд', 'доктор', 'растерян']"
66,Москва слезам не верит ,"Москва пятидесятых годов. Три молодые провинциалки приезжают в Москву в поисках того; что ищут люди во всех столицах мира — любви; счастья и достатка. Их судьбы складываются именно так; как предполагает характер каждой из девушек. 

Антонина выходит замуж; растит детей; любит мужа. Людмиле Москва представляется лотереей; в которой она должна выиграть свое особенное счастье. Катерина же — отчаянно влюбляется; но избранник ее оставляет. Однако она не опускает руки; в одиночку растит дочь и к тому же успевает сделать блестящую карьеру. В сорок лет судьба дарит ей встречу с прекрасным человеком и настоящую любовь…","['москв', 'пятидесят', 'год', 'молод', 'провинциалк', 'приезжа', 'москв', 'поиск', 'ищут', 'столиц', 'любв', 'счаст', 'достатк', 'судьб', 'складыва', 'предполага', 'характер', 'кажд', 'девушек', 'антонин', 'выход', 'замуж', 'раст', 'дет', 'люб', 'муж', 'людмил', 'москв', 'представля', 'лотере', 'должн', 'выигра', 'особен', 'счаст', 'катерин', 'отчая', 'влюбля', 'избранник', 'оставля', 'опуска', 'рук', 'одиночк', 'раст', 'доч', 'успева', 'сдела', 'блестя', 'карьер', 'сорок', 'судьб', 'дар', 'встреч', 'прекрасн', 'человек', 'настоя', 'любов']"
67,Джентльмены ,Один ушлый американец ещё со студенческих лет приторговывал наркотиками; а теперь придумал схему нелегального обогащения с использованием поместий обедневшей английской аристократии и очень неплохо на этом разбогател. Другой пронырливый журналист приходит к Рэю; правой руке американца; и предлагает тому купить киносценарий; в котором подробно описаны преступления его босса при участии других представителей лондонского криминального мира — партнёра-еврея; китайской диаспоры; чернокожих спортсменов и даже русского олигарха.,"['ушл', 'американец', 'студенческ', 'приторговыва', 'наркотик', 'придума', 'схем', 'нелегальн', 'обогащен', 'использован', 'помест', 'обедневш', 'английск', 'аристократ', 'неплох', 'разбогател', 'пронырлив', 'журналист', 'приход', 'рэ', 'прав', 'рук', 'американц', 'предлага', 'куп', 'киносценар', 'котор', 'подробн', 'описа', 'преступлен', 'босс', 'участ', 'представител', 'лондонск', 'криминальн', 'партнер', 'евре', 'китайск', 'диаспор', 'чернокож', 'спортсмен', 'русск', 'олигарх']"
68,Гран Торино ,Вышедший на пенсию автомеханик Уолт Ковальски проводит дни; починяя что-то по дому; попивая пиво и раз в месяц заходя к парикмахеру. И хотя последним желанием его недавно почившей жены было совершение им исповеди; Уолту — ожесточившемуся ветерану Корейской войны; всегда держащему свою винтовку наготове; — признаваться в общем-то не в чем. Да и нет того; кому он доверял бы в той полной мере; в какой доверяет своей собаке Дейзи.Все те люди; коих он некогда называл своими соседями; либо переехали; либо ушли в мир иной; а на смену им пришли иммигранты; которых он откровенно презирает. Противясь буквально всему; во что упирается его взгляд; — покосившиеся карнизы; заросшие лужайки домов и лица иностранцев повсюду; бесцельно шатающиеся шайки подростков; состоящие из хмонгов; латиносов и афро-американцев; полагающих; что окрестный мир целиком принадлежит им одним; неоперившиеся чужаки; в которых оказалось превратились собственные дети и внуки; — Уолт просто неспешно проживает остаток своей жизни.До той самой ночи; когда кто-то попытается украсть его «Гран Торино»…,"['вышедш', 'пенс', 'автомеханик', 'уолт', 'ковальск', 'провод', 'дни', 'почин', 'дом', 'попив', 'пив', 'месяц', 'заход', 'парикмахер', 'последн', 'желан', 'поч', 'жен', 'совершен', 'исповед', 'уолт', 'ожесточ', 'ветеран', 'корейск', 'войн', 'держа', 'винтовк', 'наготов', 'признава', 'общ', 'доверя', 'то', 'полн', 'мер', 'доверя', 'собак', 'дейз', 'ко', 'некогд', 'называ', 'сво', 'сосед', 'либ', 'перееха', 'либ', 'ушл', 'мир', 'ин', 'смен', 'пришл', 'иммигрант', 'откровен', 'презира', 'против', 'буквальн', 'упира', 'взгляд', 'покос', 'карниз', 'заросш', 'лужайк', 'дом', 'лиц', 'иностранц', 'повсюд', 'бесцельн', 'шата', 'шайк', 'подростк', 'состоя', 'хмонг', 'латинос', 'афр', 'американц', 'полага', 'окрестн', 'мир', 'целик', 'принадлеж', 'одн', 'неопер', 'чужак', 'оказа', 'преврат', 'собствен', 'дет', 'внук', 'уолт', 'неспешн', 'прожива', 'остаток', 'жизн', 'то', 'ноч', 'попыта', 'украст', 'гран', 'торин']"
69,Одержимость ,Эндрю мечтает стать великим. Казалось бы; вот-вот его мечта осуществится. Юношу замечает настоящий гений; дирижер лучшего в стране оркестра. Желание Эндрю добиться успеха быстро становится одержимостью; а безжалостный наставник продолжает подталкивать его все дальше и дальше — за пределы человеческих возможностей. Кто выйдет победителем из этой схватки?,"['эндр', 'мечта', 'стат', 'велик', 'каза', 'мечт', 'осуществ', 'юнош', 'замеча', 'настоя', 'ген', 'дирижер', 'лучш', 'стран', 'оркестр', 'желан', 'эндр', 'доб', 'успех', 'быстр', 'станов', 'одержим', 'безжалостн', 'наставник', 'продолжа', 'подталкива', 'предел', 'человеческ', 'возможн', 'выйдет', 'победител', 'схватк']"
70,Прислуга ,Американский Юг; на дворе 1960-е годы. Скитер только-только закончила университет и возвращается домой; в сонный городок Джексон; где никогда ничего не происходит. Она мечтает стать писательницей; вырваться в большой мир. Но для приличной девушки с Юга не пристало тешиться столь глупыми иллюзиями; приличной девушке следует выйти замуж и хлопотать по дому.Мудрая Эйбилин на тридцать лет старше Скитер; она прислуживает в домах белых всю свою жизнь; вынянчила семнадцать детей и давно уже ничего не ждет от жизни; ибо сердце ее разбито после смерти единственного сына.Минни — самая лучшая стряпуха во всем Джексоне; а еще она самая дерзкая служанка в городе. И острый язык не раз уже сослужил ей плохую службу. На одном месте Минни никогда подолгу не задерживается. Но с Минни лучше не связываться даже самым высокомерным белым дамочкам. Двух черных служанок и белую неопытную девушку объединяет одно — обостренное чувство справедливости и желание хоть как-то изменить порядок вещей. Смогут ли эти трое противостоять целому миру? Сумеют ли они выжить в этой борьбе?,"['американск', 'двор', 'год', 'скитер', 'законч', 'университет', 'возвраща', 'дом', 'сон', 'городок', 'джексон', 'происход', 'мечта', 'стат', 'писательниц', 'вырва', 'больш', 'мир', 'приличн', 'девушк', 'юг', 'приста', 'теш', 'стол', 'глуп', 'иллюз', 'приличн', 'девушк', 'след', 'выйт', 'замуж', 'хлопота', 'дом', 'мудр', 'эйбилин', 'тридца', 'старш', 'скитер', 'прислужива', 'дом', 'бел', 'вынянч', 'дет', 'ждет', 'жизн', 'иб', 'сердц', 'разбит', 'смерт', 'единствен', 'сын', 'мин', 'сам', 'лучш', 'стряпух', 'джексон', 'сам', 'дерзк', 'служанк', 'город', 'остр', 'язык', 'сослуж', 'плох', 'служб', 'одн', 'мест', 'мин', 'подолг', 'задержива', 'мин', 'связыва', 'сам', 'высокомерн', 'бел', 'дамочк', 'черн', 'служанок', 'бел', 'неопытн', 'девушк', 'объединя', 'одн', 'обострен', 'чувств', 'справедлив', 'желан', 'измен', 'порядок', 'вещ', 'смогут', 'тро', 'противостоя', 'цел', 'мир', 'сумеют', 'выж', 'борьб']"
71,Человек дождя ,У Чарли; грубоватого и эгоистичного молодого повесы; в наследство от отца остались лишь розовые кусты да «Бьюик» 49-го года. Внезапным «сюрпризом» для него стало открытие того; что львиная доля наследства оставлена отцом его больному аутизмом брату Раймонду.Задавшись целью отобрать свою «справедливую долю» семейного достояния; Чарли похищает старшего брата и держит его заложником. Но то; что было задумано им из эгоизма; перерастает в волшебную одиссею дружбы и самоосмысления; которая разводит границы обособленного мира Раймонда; а Чарли позволяет вырваться из оков своей некогда бесчувственной души.,"['чарл', 'грубоват', 'эгоистичн', 'молод', 'повес', 'наследств', 'отц', 'оста', 'розов', 'куст', 'бьюик', 'внезапн', 'сюрприз', 'стал', 'открыт', 'львин', 'дол', 'наследств', 'оставл', 'отц', 'больн', 'аутизм', 'брат', 'раймонд', 'зада', 'цел', 'отобра', 'справедлив', 'дол', 'семейн', 'достоян', 'чарл', 'похища', 'старш', 'брат', 'держ', 'заложник', 'задума', 'эгоизм', 'перераста', 'волшебн', 'одисс', 'дружб', 'самоосмыслен', 'развод', 'границ', 'обособлен', 'раймонд', 'чарл', 'позволя', 'вырва', 'ок', 'некогд', 'бесчувствен', 'душ']"
72,Изгой ,Герой этого фильма; Чак Ноланд; — сотрудник всемирно известной службы доставки «Федерал Экспресс». Чак — скрупулезный практик и неисправимый педант. Жизнь Ноланда; высокопоставленного инспектора международных отделений «ФедЕкс» расписана по минутам. И этих драгоценных минут катастрофически не хватает ни на личную жизнь; ни на любимую женщину…Однако безжалостная судьба заставила Ноланда иначе взглянуть на отпущенное ему время… Самолет; на котором путешествует Чак; падает в океан. Инженер; единственный; кому посчастливилось остаться в живых; попадает на необитаемый остров. Здесь Ноланду предстоит провести мучительно долгие годы в жестокой битве за выживание…,"['гер', 'фильм', 'чак', 'ноланд', 'сотрудник', 'всемирн', 'известн', 'служб', 'доставк', 'федера', 'экспресс', 'чак', 'скрупулезн', 'практик', 'неисправим', 'педант', 'ноланд', 'высокопоставлен', 'инспектор', 'международн', 'отделен', 'федекс', 'расписа', 'минут', 'драгоцен', 'минут', 'катастрофическ', 'хвата', 'личн', 'любим', 'женщин', 'безжалостн', 'судьб', 'застав', 'ноланд', 'инач', 'взглянут', 'отпущен', 'самолет', 'котор', 'путешеств', 'чак', 'пада', 'океа', 'инженер', 'единствен', 'посчастлив', 'оста', 'жив', 'попада', 'необита', 'остр', 'ноланд', 'предсто', 'провест', 'мучительн', 'долг', 'год', 'жесток', 'битв', 'выживан']"
73,Летят журавли ,Рассказ о людях; в чьи судьбы безжалостно вторглась война. Не все смогли с честью вынести это испытание. В центре киноповести — трагическая история двух влюбленных; которых разлучила война.,"['рассказ', 'люд', 'чьи', 'судьб', 'безжалостн', 'вторгл', 'войн', 'смогл', 'чест', 'вынест', 'испытан', 'центр', 'киноповест', 'трагическ', 'истор', 'влюблен', 'разлуч', 'войн']"
74,Шестое чувство ,Детский психиатр Малкольм Кроу сталкивается со странным случаем: девятилетнего Коула посещают страшные видения — призраки умерших. Все эти люди когда-то были убиты; и теперь они обрушивают на малыша свой гнетущий страх и отчаянный гнев.Как врач Малкольм бессилен помочь. Но как человек он пытается найти ключ к ужасному миру Коула; в котором веет дыханием смерти; и распускаются страшные цветы боли.,"['детск', 'психиатр', 'малкольм', 'кро', 'сталкива', 'стран', 'случа', 'девятилетн', 'коул', 'посеща', 'страшн', 'виден', 'призрак', 'умерш', 'убит', 'обрушива', 'малыш', 'сво', 'гнетущ', 'страх', 'отчая', 'гнев', 'врач', 'малкольм', 'бессил', 'помоч', 'пыта', 'найт', 'ключ', 'ужасн', 'мир', 'коул', 'котор', 'веет', 'дыхан', 'смерт', 'распуска', 'страшн', 'цвет', 'бол']"
75,Зверополис ,Добро пожаловать в Зверополис — современный город; населенный самыми разными животными; от огромных слонов до крошечных мышек. Зверополис разделен на районы; полностью повторяющие естественную среду обитания разных жителей — здесь есть и элитный район Площадь Сахары и неприветливый Тундратаун. В этом городе появляется новый офицер полиции; жизнерадостная зайчиха Джуди Хоппс; которая с первых дней работы понимает; как сложно быть маленькой и пушистой среди больших и сильных полицейских. Джуди хватается за первую же возможность проявить себя; несмотря на то; что ее партнером будет болтливый хитрый лис Ник Уайлд. Вдвоем им предстоит раскрыть сложное дело; от которого будет зависеть судьба всех обитателей Зверополиса.,"['добр', 'пожалова', 'зверополис', 'современ', 'город', 'населен', 'сам', 'разн', 'животн', 'огромн', 'слон', 'крошечн', 'мышек', 'зверополис', 'раздел', 'район', 'полност', 'повторя', 'естествен', 'сред', 'обитан', 'разн', 'жител', 'элитн', 'район', 'площад', 'сахар', 'неприветлив', 'тундратаун', 'город', 'появля', 'нов', 'офицер', 'полиц', 'жизнерадостн', 'зайчих', 'джуд', 'хоппс', 'перв', 'дне', 'работ', 'понима', 'сложн', 'маленьк', 'пушист', 'сред', 'больш', 'сильн', 'полицейск', 'джуд', 'хвата', 'перв', 'возможн', 'прояв', 'несмотр', 'партнер', 'болтлив', 'хитр', 'лис', 'ник', 'уайлд', 'вдво', 'предсто', 'раскр', 'сложн', 'дел', 'зависет', 'судьб', 'обитател', 'зверополис']"
