,movie,overview,preprocessed
180,Индиана Джонс и последний крестовый поход ,Третья часть невероятных похождений прославленного археолога и искателя приключений Индианы Джонса. На этот раз бесстрашный Индиана разыскивает самую таинственную реликвию в истории человечества — Святой Грааль. В этом археологу помогает его отец — профессор Джонс старший.Теперь под бдительным оком своего отца и при помощи своих верных талисманов; неизменной шляпы и хлыста; Индиане предстоит совершить много благородных подвигов и потрясающих открытий. В новых странствиях храброму археологу доведется добыть чашу; которую держал в руках Иисус Христос и получить автограф… самого Адольфа Гитлера.,"['трет', 'част', 'невероятн', 'похожден', 'прославлен', 'археолог', 'искател', 'приключен', 'индиа', 'джонс', 'бесстрашн', 'индиа', 'разыскива', 'сам', 'таинствен', 'реликв', 'истор', 'человечеств', 'свят', 'граал', 'археолог', 'помога', 'отец', 'профессор', 'джонс', 'старш', 'бдительн', 'ок', 'отц', 'помощ', 'верн', 'талисман', 'неизмен', 'шляп', 'хлыст', 'индиан', 'предсто', 'соверш', 'благородн', 'подвиг', 'потряса', 'открыт', 'нов', 'странств', 'храбр', 'археолог', 'доведет', 'доб', 'чаш', 'котор', 'держа', 'рук', 'иисус', 'христос', 'получ', 'автограф', 'адольф', 'гитлер']"
181,Схватка ,Нил МакКоли — один из лучших преступников Лос-Анджелеса. Ему противостоит лучший детектив Винсент Ханна. Две сильнейшие команды сходятся друг против друга в смертельной схватке.,"['нил', 'маккол', 'лучш', 'преступник', 'лос', 'анджелес', 'противосто', 'лучш', 'детект', 'винсент', 'хан', 'сильн', 'команд', 'сход', 'друг', 'друг', 'смертельн', 'схватк']"
182,Военный ныряльщик ,Фильм основан на реальных событиях из жизни легендарного водолаза Карла Брашира. Его наставник и старший офицер Билл Сандэй убежден; что неграм нечего делать во флоте; и самыми жестокими и бесчеловечными способами издевается и «обламывает» амбициозного новичка.Однако ему это не удается; и более того; вскоре он начинает испытывать симпатию к этому чрезвычайно упертому парню; который скорее погибнет; чем покажет слабость. Вместе они пытаются сопротивляться бюрократам из командования ВМФ; которых не устраивает цвет кожи героя.Карл всегда вызывается добровольцем на выполнение самых опасных секретных спецопераций; связанных с повышенным риском для жизни. Однако судьба приготовила ему куда более страшное испытание; преодолеть которое способен только настоящий герой.,"['фильм', 'основа', 'реальн', 'событ', 'жизн', 'легендарн', 'водолаз', 'карл', 'брашир', 'наставник', 'старш', 'офицер', 'билл', 'сандэ', 'убежд', 'негр', 'неч', 'дела', 'флот', 'сам', 'жесток', 'бесчеловечн', 'способ', 'издева', 'обламыва', 'амбициозн', 'новичк', 'уда', 'вскор', 'начина', 'испытыва', 'симпат', 'чрезвычайн', 'уперт', 'парн', 'скор', 'погибнет', 'покажет', 'слабост', 'вмест', 'пыта', 'сопротивля', 'бюрократ', 'командован', 'вмф', 'устраива', 'цвет', 'кож', 'геро', 'карл', 'вызыва', 'добровольц', 'выполнен', 'сам', 'опасн', 'секретн', 'спецоперац', 'связа', 'повышен', 'риск', 'жизн', 'судьб', 'приготов', 'страшн', 'испытан', 'преодолет', 'котор', 'способ', 'настоя', 'гер']"
183,Октябрьское небо ,В октябре 1957 года произошло событие эпохального значения. Советский Союз впервые в истории человечества запустил на земную орбиту первый «Спутник». Мир стал другим.Запуск советской ракеты произвел неизгладимое впечатление на мальчика по имени Хомер Хикэм из небольшого шахтерского городка Колвуд в Западной Вирджинии. Всерьез «заболевший» космосом; Хомер решает построить собственную ракету. В этом ему начинают помогать трое друзей и школьная учительница. Однако отец Хомера; шахтер — работяга; видящий сына только в роли продолжателя своего нелегкого дела; категорически противится стремлениям своего ребенка.Но; несмотря ни на что; мальчик сделает все возможное и невозможное; чтобы его мечта стала явью…,"['октябр', 'произошл', 'событ', 'эпохальн', 'значен', 'советск', 'союз', 'вперв', 'истор', 'человечеств', 'запуст', 'земн', 'орбит', 'спутник', 'мир', 'друг', 'запуск', 'советск', 'ракет', 'произвел', 'неизгладим', 'впечатлен', 'мальчик', 'имен', 'хомер', 'хикэм', 'небольш', 'шахтерск', 'городк', 'колвуд', 'западн', 'вирджин', 'всерьез', 'заболевш', 'космос', 'хомер', 'реша', 'постро', 'собствен', 'ракет', 'начина', 'помога', 'тро', 'друз', 'школьн', 'учительниц', 'отец', 'хомер', 'шахтер', 'работяг', 'видя', 'сын', 'рол', 'продолжател', 'нелегк', 'дел', 'категорическ', 'против', 'стремлен', 'ребенк', 'несмотр', 'мальчик', 'сдела', 'возможн', 'невозможн', 'мечт', 'стал', 'яв']"
184,Принцесса Мононоке ,Юный принц Аситака; убив вепря; навлек на себя смертельное проклятие. Старая знахарка предсказала ему; что только он сам способен изменить свою судьбу. И отважный воин отправился в опасное путешествие. Так он оказался в загадочной стране; где люди под предводительством злой госпожи Эбоси воевали с обитателями леса: духами; демонами и гигантскими существами; каких Аситака раньше никогда не видел. И была с ними принцесса Мононоке — повелительница зверей и дочь волчицы. Теперь судьба всех зависит только от одного воина — принца Аситаки.,"['юн', 'принц', 'аситак', 'уб', 'вепр', 'навлек', 'смертельн', 'проклят', 'стар', 'знахарк', 'предсказа', 'способ', 'измен', 'судьб', 'отважн', 'воин', 'отправ', 'опасн', 'путешеств', 'оказа', 'загадочн', 'стран', 'предводительств', 'зло', 'госпож', 'эбос', 'воева', 'обитател', 'лес', 'дух', 'демон', 'гигантск', 'существ', 'как', 'аситак', 'видел', 'принцесс', 'мононок', 'повелительниц', 'звер', 'доч', 'волчиц', 'судьб', 'завис', 'воин', 'принц', 'аситак']"
185,Знахарь ,С гениальным хирургом Рафалом Вильчуром происходит трагедия; изменившая всю его жизнь. Уходят жена и дочь; в тот же день он оказывается на улице без денег и документов. Ему приходится пережить несколько лет скитаний и горя.И все-таки судьба поворачивается к нему лицом. Найдя приют в семье мельника; он спасает его больного сына и становится членом семьи. Молва о «знахаре» расходится по всей округе… А вскоре он встречает и красивую девушку; похожую на жену…,"['гениальн', 'хирург', 'рафал', 'вильчур', 'происход', 'трагед', 'измен', 'уход', 'жен', 'доч', 'оказыва', 'улиц', 'денег', 'документ', 'приход', 'переж', 'скитан', 'гор', 'так', 'судьб', 'поворачива', 'лиц', 'найд', 'приют', 'сем', 'мельник', 'спаса', 'больн', 'сын', 'станов', 'член', 'сем', 'молв', 'знахар', 'расход', 'все', 'округ', 'вскор', 'встреча', 'красив', 'девушк', 'похож', 'жен']"
186,Джокер ,Готэм; начало 1980-х годов. Комик Артур Флек живет с больной матерью; которая с детства учит его «ходить с улыбкой». Пытаясь нести в мир хорошее и дарить людям радость; Артур сталкивается с человеческой жестокостью и постепенно приходит к выводу; что этот мир получит от него не добрую улыбку; а ухмылку злодея Джокера.,"['готэм', 'нача', 'год', 'комик', 'артур', 'флек', 'живет', 'больн', 'матер', 'детств', 'уч', 'ход', 'улыбк', 'пыт', 'нест', 'мир', 'хорош', 'дар', 'люд', 'радост', 'артур', 'сталкива', 'человеческ', 'жесток', 'постепен', 'приход', 'вывод', 'мир', 'получ', 'добр', 'улыбк', 'ухмылк', 'злоде', 'джокер']"
187,Звёздные войны: Эпизод 6 – Возвращение Джедая ,В шестом эпизоде «Звездных войн» Дарт Вейдер создает вторую «Звезду Смерти». Он объединяет все силы зла; чтобы с помощью этого смертоносного оружия нанести последний сокрушительный удар по повстанцам и их союзникам.Люк Скайуокер вместе с принцессой Лейей и верными дроидами R2D2 и C-3PO отправляется спасать своего друга Хана Соло; который попал в плен к отвратительному Джаббе Хатту — могущественному повелителю преступников.Повстанцы высаживаются на планету Эндор; чтобы оттуда вместе с Люком и его отрядом предпринять последнюю атаку на Имперский флот; атаку; от которой зависит судьба Галактики. В этом эпизоде Люк Скайуокер и Дарт Вейдер встречаются в последний раз… ибо из поединка между отцом и сыном живым выйдет только один…,"['шест', 'эпизод', 'звездн', 'войн', 'дарт', 'вейдер', 'созда', 'втор', 'звезд', 'смерт', 'объединя', 'сил', 'зла', 'помощ', 'смертоносн', 'оруж', 'нанест', 'последн', 'сокрушительн', 'удар', 'повстанц', 'союзник', 'люк', 'скайуокер', 'вмест', 'принцесс', 'лей', 'верн', 'дроид', 'отправля', 'спаса', 'друг', 'хан', 'сол', 'попа', 'плен', 'отвратительн', 'джабб', 'хатт', 'могуществен', 'повелител', 'преступник', 'повстанц', 'высажива', 'планет', 'эндор', 'оттуд', 'вмест', 'люк', 'отряд', 'предприня', 'последн', 'атак', 'имперск', 'флот', 'атак', 'завис', 'судьб', 'галактик', 'эпизод', 'люк', 'скайуокер', 'дарт', 'вейдер', 'встреча', 'последн', 'иб', 'поединк', 'отц', 'сын', 'жив', 'выйдет']"
188,Психо ,Мэрион Крэйн недовольна романом с разведенным мужчиной; который уделяет ей внимание только наездами. Поэтому девушка крадет на работе крупную сумму и в спешке бежит из города. В мотеле; где Мэрион останавливается на ночь; она знакомится с его владельцем — очень странным молодым человеком.,"['мэрион', 'крэйн', 'недовольн', 'роман', 'разведен', 'мужчин', 'уделя', 'вниман', 'наезд', 'поэт', 'девушк', 'крадет', 'работ', 'крупн', 'сумм', 'спешк', 'беж', 'город', 'мотел', 'мэрион', 'останавлива', 'ноч', 'знаком', 'владельц', 'стран', 'молод', 'человек']"
189,Ип Ман ,Ип Ман — признанный мастер кунг-фу; живущий в Фошане; городе; славном своими школами боевых искусств. Ип Ман практикует вин-чун и; хотя является сильнейшим бойцом города; своей школы у него нет; и он не берет учеников. Дома он проводит лишь легкие спарринги с приятелями. Проходят годы; Китай захватывают воинственные японцы; и Ип Ман оказывается одним из немногих; кто даже в жесточайших условиях оккупации не забывает о чести; достоинстве и; конечно же; мудрости; которую несет в себе кунг-фу.,"['ман', 'призна', 'мастер', 'кунг', 'живущ', 'фошан', 'город', 'славн', 'сво', 'школ', 'боев', 'искусств', 'ман', 'практик', 'вин', 'чун', 'явля', 'сильн', 'бойц', 'город', 'школ', 'берет', 'ученик', 'дом', 'провод', 'легк', 'спарринг', 'приятел', 'проход', 'год', 'кита', 'захватыва', 'воинствен', 'японц', 'ман', 'оказыва', 'одн', 'немног', 'жесточайш', 'услов', 'оккупац', 'забыва', 'чест', 'достоинств', 'мудрост', 'котор', 'несет', 'кунг']"
190,Новый кинотеатр «Парадизо» ,Это рассказ о счастливых днях; когда итальянское кино еще не знало о том; что такое «кризис итальянского кинематографа». В центре разделенной как бы на три части картины — сицилийский мальчишка Сальваторе.,"['рассказ', 'счастлив', 'днях', 'итальянск', 'кин', 'знал', 'кризис', 'итальянск', 'кинематограф', 'центр', 'разделен', 'част', 'картин', 'сицилийск', 'мальчишк', 'сальватор']"
191,Шрэк ,Жил да был в сказочном государстве большой зеленый великан по имени Шрек. Жил он в гордом одиночестве в лесу; на болоте; которое считал своим. Но однажды злобный коротышка — лорд Фаркуад; правитель волшебного королевства; безжалостно согнал на Шреково болото всех сказочных обитателей.И беспечной жизни зеленого великана пришел конец. Но лорд Фаркуад пообещал вернуть Шреку болото; если великан добудет ему прекрасную принцессу Фиону; которая томится в неприступной башне; охраняемой огнедышащим драконом…,"['жил', 'сказочн', 'государств', 'больш', 'зелен', 'велика', 'имен', 'шрек', 'жил', 'горд', 'одиночеств', 'лес', 'болот', 'котор', 'счита', 'сво', 'злобн', 'коротышк', 'лорд', 'фаркуад', 'правител', 'волшебн', 'королевств', 'безжалостн', 'согна', 'шреков', 'болот', 'сказочн', 'обитател', 'беспечн', 'жизн', 'зелен', 'велика', 'пришел', 'конец', 'лорд', 'фаркуад', 'пообеща', 'вернут', 'шрек', 'болот', 'велика', 'добудет', 'прекрасн', 'принцесс', 'фион', 'том', 'неприступн', 'башн', 'охраня', 'огнедыша', 'дракон']"
192,Иллюзионист ,"Вена. Начало 20 века. В городе появляется загадочный человек; называвший себя иллюзионистом Эйзенхаймом. Он показывает публике невиданные фокусы; которые кажутся не иначе как волшебством. 

Слава о необыкновенном чародее доходит до кронпринца Леопольда; который почтил своим присутствием одно из представлений Эйзенхайма. Леопольда сопровождает его будущая невеста Софи. Её появление в зале дает толчок для целой вереницы необъяснимых событий; корни которых уходят в прошлое…","['вен', 'нача', 'век', 'город', 'появля', 'загадочн', 'называ', 'иллюзионист', 'эйзенхайм', 'показыва', 'публик', 'невида', 'фокус', 'кажут', 'инач', 'волшебств', 'слав', 'необыкновен', 'чарод', 'доход', 'кронпринц', 'леопольд', 'почт', 'сво', 'присутств', 'одн', 'представлен', 'эйзенхайм', 'леопольд', 'сопровожда', 'будущ', 'невест', 'соф', 'появлен', 'зал', 'дает', 'толчок', 'цел', 'верениц', 'необъясним', 'событ', 'корн', 'уход', 'прошл']"
193,Последний самурай ,Действие разворачивается в Японии 70-ых годов девятнадцатого века. Капитан Нейтон Альгрен; уважаемый американский военный офицер; нанят Императором Японии для обучения первой армии Страны Восходящего Солнца современному искусству ведения боевых действий.Император пытается искоренить древних воинов-самураев; готовясь к более прозападной политике правительства…,"['действ', 'разворачива', 'япон', 'год', 'девятнадцат', 'век', 'капита', 'нейтон', 'альгр', 'уважа', 'американск', 'воен', 'офицер', 'нан', 'император', 'япон', 'обучен', 'перв', 'арм', 'стран', 'восходя', 'солнц', 'современ', 'искусств', 'веден', 'боев', 'действ', 'император', 'пыта', 'искорен', 'древн', 'воин', 'самура', 'готов', 'прозападн', 'политик', 'правительств']"
194,Звёздочки на земле ,Маленький мальчик 8 лет Ишан Авасти с рождения немного отличается от других детей. Ему дается с трудом то; что у других получается очень легко. Мир не понимает этого ребенка; как и его собственные родители. Когда Ишан в третий раз проваливает экзамены в школе; его отец в наказание отправляет мальчика в школу-интернат. Одиночество губит ребенка; он осуждает себя за расставание с родителями; но и их не может простить. Однажды в жизни Ишана появляется временный учитель рисования Рам Никум — единственный; кто понимает этого ребенка. Рам ставит перед собой цель изменить жизнь мальчика и отношение к нему.,"['маленьк', 'мальчик', 'иша', 'аваст', 'рожден', 'отлича', 'дет', 'дает', 'труд', 'получа', 'легк', 'мир', 'понима', 'ребенк', 'собствен', 'родител', 'иша', 'провалива', 'экзам', 'школ', 'отец', 'наказан', 'отправля', 'мальчик', 'школ', 'интернат', 'одиночеств', 'губ', 'ребенк', 'осужда', 'расставан', 'родител', 'прост', 'жизн', 'иша', 'появля', 'времен', 'учител', 'рисован', 'рам', 'никум', 'единствен', 'понима', 'ребенк', 'рам', 'став', 'цел', 'измен', 'мальчик', 'отношен']"
195,Гарри Поттер и узник Азкабана ,В третьей части истории о юном волшебнике полюбившиеся всем герои — Гарри Поттер; Рон и Гермиона — возвращаются уже на третий курс школы чародейства и волшебства Хогвартс. На этот раз они должны раскрыть тайну узника; сбежавшего из зловещей тюрьмы Азкабан; чье пребывание на воле создает для Гарри смертельную опасность…,"['трет', 'част', 'истор', 'юн', 'волшебник', 'полюб', 'геро', 'гарр', 'поттер', 'рон', 'гермион', 'возвраща', 'курс', 'школ', 'чародейств', 'волшебств', 'хогвартс', 'должн', 'раскр', 'тайн', 'узник', 'сбежа', 'зловещ', 'тюрьм', 'азкаба', 'чье', 'пребыван', 'вол', 'созда', 'гарр', 'смертельн', 'опасн']"
