,movie,overview,preprocessed
0,Побег из Шоушенка ,Бухгалтер Энди Дюфрейн обвинён в убийстве собственной жены и её любовника. Оказавшись в тюрьме под названием Шоушенк; он сталкивается с жестокостью и беззаконием; царящими по обе стороны решётки. Каждый; кто попадает в эти стены; становится их рабом до конца жизни. Но Энди; обладающий живым умом и доброй душой; находит подход как к заключённым; так и к охранникам; добиваясь их особого к себе расположения.,"['бухгалтер', 'энд', 'дюфрейн', 'обвин', 'убийств', 'собствен', 'жен', 'любовник', 'оказа', 'тюрьм', 'назван', 'шоушенк', 'сталкива', 'жесток', 'беззакон', 'царя', 'об', 'сторон', 'решетк', 'попада', 'стен', 'станов', 'раб', 'конц', 'жизн', 'энд', 'облада', 'жив', 'ум', 'добр', 'душ', 'наход', 'подход', 'заключен', 'охранник', 'добив', 'особ', 'расположен']"
1,Зеленая миля ,Пол Эджкомб — начальник блока смертников в тюрьме «Холодная гора»; каждый из узников которого однажды проходит «зеленую милю» по пути к месту казни. Пол повидал много заключённых и надзирателей за время работы. Однако гигант Джон Коффи; обвинённый в страшном преступлении; стал одним из самых необычных обитателей блока.,"['пол', 'эджкомб', 'начальник', 'блок', 'смертник', 'тюрьм', 'холодн', 'гор', 'узник', 'проход', 'зелен', 'мил', 'пут', 'мест', 'казн', 'пол', 'повида', 'заключен', 'надзирател', 'работ', 'гигант', 'джон', 'кофф', 'обвинен', 'страшн', 'преступлен', 'одн', 'сам', 'необычн', 'обитател', 'блок']"
2,Форрест Гамп ,От лица главного героя Форреста Гампа; слабоумного безобидного человека с благородным и открытым сердцем; рассказывается история его необыкновенной жизни.Фантастическим образом превращается он в известного футболиста; героя войны; преуспевающего бизнесмена. Он становится миллиардером; но остается таким же бесхитростным; глупым и добрым. Форреста ждет постоянный успех во всем; а он любит девочку; с которой дружил в детстве; но взаимность приходит слишком поздно.,"['лиц', 'главн', 'геро', 'форрест', 'гамп', 'слабоумн', 'безобидн', 'человек', 'благородн', 'открыт', 'сердц', 'рассказыва', 'истор', 'необыкновен', 'жизн', 'фантастическ', 'образ', 'превраща', 'известн', 'футболист', 'геро', 'войн', 'преуспева', 'бизнесм', 'станов', 'миллиардер', 'оста', 'так', 'бесхитростн', 'глуп', 'добр', 'форрест', 'ждет', 'постоя', 'успех', 'люб', 'девочк', 'друж', 'детств', 'взаимност', 'приход', 'поздн']"
3,Список Шиндлера ,Фильм рассказывает реальную историю загадочного Оскара Шиндлера; члена нацистской партии; преуспевающего фабриканта; спасшего во время Второй мировой войны почти 1200 евреев.,"['фильм', 'рассказыва', 'реальн', 'истор', 'загадочн', 'оскар', 'шиндлер', 'член', 'нацистск', 'парт', 'преуспева', 'фабрикант', 'спасш', 'миров', 'войн', 'евре']"
4,1+1 ,Пострадав в результате несчастного случая; богатый аристократ Филипп нанимает в помощники человека; который менее всего подходит для этой работы; — молодого жителя предместья Дрисса; только что освободившегося из тюрьмы. Несмотря на то; что Филипп прикован к инвалидному креслу; Дриссу удается привнести в размеренную жизнь аристократа дух приключений.,"['пострада', 'результат', 'несчастн', 'случ', 'богат', 'аристократ', 'филипп', 'нанима', 'помощник', 'человек', 'подход', 'работ', 'молод', 'жител', 'предмест', 'дрисс', 'освобод', 'тюрьм', 'несмотр', 'филипп', 'прикова', 'инвалидн', 'кресл', 'дрисс', 'уда', 'привнест', 'размерен', 'аристократ', 'дух', 'приключен']"
5,Начало ,Кобб — талантливый вор; лучший из лучших в опасном искусстве извлечения: он крадет ценные секреты из глубин подсознания во время сна; когда человеческий разум наиболее уязвим. Редкие способности Кобба сделали его ценным игроком в привычном к предательству мире промышленного шпионажа; но они же превратили его в извечного беглеца и лишили всего; что он когда-либо любил. И вот у Кобба появляется шанс исправить ошибки. Его последнее дело может вернуть все назад; но для этого ему нужно совершить невозможное — инициацию. Вместо идеальной кражи Кобб и его команда спецов должны будут провернуть обратное. Теперь их задача — не украсть идею; а внедрить ее. Если у них получится; это и станет идеальным преступлением. Но никакое планирование или мастерство не могут подготовить команду к встрече с опасным противником; который; кажется; предугадывает каждый их ход. Врагом; увидеть которого мог бы лишь Кобб.,"['кобб', 'талантлив', 'вор', 'лучш', 'лучш', 'опасн', 'искусств', 'извлечен', 'крадет', 'цен', 'секрет', 'глубин', 'подсознан', 'сна', 'человеческ', 'разум', 'уязв', 'редк', 'способн', 'кобб', 'сдела', 'цен', 'игрок', 'привычн', 'предательств', 'мир', 'промышлен', 'шпионаж', 'преврат', 'извечн', 'беглец', 'лиш', 'либ', 'люб', 'кобб', 'появля', 'шанс', 'исправ', 'ошибк', 'последн', 'дел', 'вернут', 'соверш', 'невозможн', 'инициац', 'вмест', 'идеальн', 'краж', 'кобб', 'команд', 'спец', 'должн', 'провернут', 'обратн', 'задач', 'украст', 'ид', 'внедр', 'получ', 'станет', 'идеальн', 'преступлен', 'никак', 'планирован', 'мастерств', 'подготов', 'команд', 'встреч', 'опасн', 'противник', 'предугадыва', 'ход', 'враг', 'увидет', 'кобб']"
6,Леон ,Профессиональный убийца Леон; не знающий пощады и жалости; знакомится со своей очаровательной соседкой Матильдой; семью которой расстреливают полицейские; замешанные в торговле наркотиками. Благодаря этому знакомству он впервые испытывает чувство любви; но…,"['профессиональн', 'убийц', 'леон', 'знающ', 'пощад', 'жалост', 'знаком', 'очаровательн', 'соседк', 'матильд', 'сем', 'расстрелива', 'полицейск', 'замеша', 'торговл', 'наркотик', 'благодар', 'знакомств', 'вперв', 'испытыва', 'чувств', 'любв']"
7,Король Лев ,У величественного Короля-Льва Муфасы рождается наследник по имени Симба. Уже в детстве любознательный малыш становится жертвой интриг своего завистливого дяди Шрама; мечтающего о власти.Симба познаёт горе утраты; предательство и изгнание; но в конце концов обретает верных друзей и находит любимую. Закалённый испытаниями; он в нелёгкой борьбе отвоёвывает своё законное место в «Круге жизни»; осознав; что значит быть настоящим Королём.,"['величествен', 'корол', 'льва', 'муфас', 'рожда', 'наследник', 'имен', 'симб', 'детств', 'любознательн', 'малыш', 'станов', 'жертв', 'интриг', 'завистлив', 'дяд', 'шрам', 'мечта', 'власт', 'симб', 'позна', 'гор', 'утрат', 'предательств', 'изгнан', 'конц', 'конц', 'обрета', 'верн', 'друз', 'наход', 'любим', 'закален', 'испытан', 'нелегк', 'борьб', 'отвоевыва', 'сво', 'закон', 'мест', 'круг', 'жизн', 'осозна', 'настоя', 'корол']"
8,Бойцовский клуб ,Сотрудник страховой компании страдает хронической бессонницей и отчаянно пытается вырваться из мучительно скучной жизни. Однажды в очередной командировке он встречает некоего Тайлера Дёрдена — харизматического торговца мылом с извращенной философией. Тайлер уверен; что самосовершенствование — удел слабых; а единственное; ради чего стоит жить — саморазрушение.Проходит немного времени; и вот уже новые друзья лупят друг друга почем зря на стоянке перед баром; и очищающий мордобой доставляет им высшее блаженство. Приобщая других мужчин к простым радостям физической жестокости; они основывают тайный Бойцовский клуб; который начинает пользоваться невероятной популярностью.,"['сотрудник', 'страхов', 'компан', 'страда', 'хроническ', 'бессонниц', 'отчая', 'пыта', 'вырва', 'мучительн', 'скучн', 'жизн', 'очередн', 'командировк', 'встреча', 'неко', 'тайлер', 'дерд', 'харизматическ', 'торговц', 'мыл', 'извращен', 'философ', 'тайлер', 'увер', 'самосовершенствован', 'удел', 'слаб', 'единствен', 'рад', 'сто', 'жит', 'саморазрушен', 'проход', 'нов', 'друз', 'луп', 'друг', 'друг', 'поч', 'зря', 'стоянк', 'бар', 'очища', 'мордоб', 'доставля', 'высш', 'блаженств', 'приобщ', 'мужчин', 'прост', 'радост', 'физическ', 'жесток', 'основыва', 'тайн', 'бойцовск', 'клуб', 'начина', 'пользова', 'невероятн', 'популярн']"
9,Иван Васильевич меняет профессию ,Инженер-изобретатель Тимофеев сконструировал машину времени; которая соединила его квартиру с далеким шестнадцатым веком — точнее; с палатами государя Ивана Грозного. Туда-то и попадают тезка царя пенсионер-общественник Иван Васильевич Бунша и квартирный вор Жорж Милославский.На их место в двадцатом веке «переселяется» великий государь. Поломка машины приводит ко множеству неожиданных и забавных событий…,"['инженер', 'изобретател', 'тимофе', 'сконструирова', 'машин', 'соедин', 'квартир', 'далек', 'шестнадцат', 'век', 'точн', 'палат', 'государ', 'ива', 'грозн', 'попада', 'тезк', 'цар', 'пенсионер', 'общественник', 'ива', 'васильевич', 'бунш', 'квартирн', 'вор', 'жорж', 'милославск', 'мест', 'двадцат', 'век', 'переселя', 'велик', 'государ', 'поломк', 'машин', 'привод', 'множеств', 'неожида', 'забавн', 'событ']"
10,Жизнь прекрасна ,Во время II Мировой войны в Италии в концлагерь были отправлены евреи; отец и его маленький сын. Жена; итальянка; добровольно последовала вслед за ними. В лагере отец сказал сыну; что все происходящее вокруг является очень большой игрой за приз в настоящий танк; который достанется тому мальчику; который сможет не попасться на глаза надзирателям.,"['миров', 'войн', 'итал', 'концлагер', 'отправл', 'евр', 'отец', 'маленьк', 'сын', 'жен', 'итальянк', 'добровольн', 'последова', 'вслед', 'лагер', 'отец', 'сын', 'происходя', 'явля', 'больш', 'игр', 'приз', 'настоя', 'танк', 'достанет', 'мальчик', 'сможет', 'попаст', 'глаз', 'надзирател']"
11,Достучаться до небес ,Судьба сводит героев картины в больнице; где врачи выносят им смертный приговор. Счет времени их жизней идет на часы. Дальнейшие события в фильме разворачиваются в стремительном темпе. Украв машину с миллионом немецких марок в багажнике; они сбегают из больницы.Их преследуют наемные убийцы; они становятся грабителями поневоле; за ними гонится полиция; они попадают в бордель. Но тем не менее продолжают мчаться вперед; навстречу своей судьбе.,"['судьб', 'свод', 'геро', 'картин', 'больниц', 'врач', 'вынос', 'смертн', 'приговор', 'счет', 'жизн', 'идет', 'час', 'дальн', 'событ', 'фильм', 'разворачива', 'стремительн', 'темп', 'укра', 'машин', 'миллион', 'немецк', 'марок', 'багажник', 'сбега', 'больниц', 'преслед', 'наемн', 'убийц', 'станов', 'грабител', 'поневол', 'гон', 'полиц', 'попада', 'бордел', 'продолжа', 'мчат', 'вперед', 'навстреч', 'судьб']"
12,Крестный отец ,Криминальная сага; повествующая о нью-йоркской сицилийской мафиозной семье Корлеоне. Фильм охватывает период 1945-1955 годов.Глава семьи; Дон Вито Корлеоне; выдаёт замуж свою дочь. В это время со Второй мировой войны возвращается его любимый сын Майкл. Майкл; герой войны; гордость семьи; не выражает желания заняться жестоким семейным бизнесом. Дон Корлеоне ведёт дела по старым правилам; но наступают иные времена; и появляются люди; желающие изменить сложившиеся порядки. На Дона Корлеоне совершается покушение.,"['криминальн', 'саг', 'повествующ', 'нью', 'йоркск', 'сицилийск', 'мафиозн', 'сем', 'корлеон', 'фильм', 'охватыва', 'период', 'год', 'глав', 'сем', 'дон', 'вит', 'корлеон', 'выда', 'замуж', 'доч', 'миров', 'войн', 'возвраща', 'любим', 'сын', 'майкл', 'майкл', 'гер', 'войн', 'гордост', 'сем', 'выража', 'желан', 'заня', 'жесток', 'семейн', 'бизнес', 'дон', 'корлеон', 'ведет', 'дел', 'стар', 'правил', 'наступа', 'ин', 'врем', 'появля', 'жела', 'измен', 'слож', 'порядк', 'дон', 'корлеон', 'соверша', 'покушен']"
13,Криминальное чтиво ,Двое бандитов Винсент Вега и Джулс Винфилд ведут философские беседы в перерывах между разборками и решением проблем с должниками криминального босса Марселласа Уоллеса.В первой истории Винсент проводит незабываемый вечер с женой Марселласа Мией. Во второй рассказывается о боксёре Бутче Кулидже; купленном Уоллесом; чтобы сдать бой. В третьей истории Винсент и Джулс по нелепой случайности попадают в неприятности.,"['дво', 'бандит', 'винсент', 'вег', 'джулс', 'винфилд', 'ведут', 'философск', 'бесед', 'перерыв', 'разборк', 'решен', 'пробл', 'должник', 'криминальн', 'босс', 'марселлас', 'уоллес', 'перв', 'истор', 'винсент', 'провод', 'незабыва', 'вечер', 'жен', 'марселлас', 'ми', 'рассказыва', 'боксер', 'бутч', 'кулидж', 'куплен', 'уоллес', 'сдат', 'бо', 'трет', 'истор', 'винсент', 'джулс', 'нелеп', 'случайн', 'попада', 'неприятн']"
14,Операция «Ы» и другие приключения Шурика ,Фильм состоит из трех новелл; объединенных фигурой главного героя Шурика; попадающего в самые невероятные ситуации. В «Напарнике» Шурик сражается с хулиганом Верзилой; в «Наваждении» весьма оригинальным способом готовится к экзамену; в «Операции «Ы» предотвращает «ограбление века»; на которое идет знаменитая тройка — Балбес; Трус и Бывалый.,"['фильм', 'состо', 'трех', 'новелл', 'объединен', 'фигур', 'главн', 'геро', 'шурик', 'попада', 'сам', 'невероятн', 'ситуац', 'напарник', 'шурик', 'сража', 'хулиган', 'верзил', 'наважден', 'весьм', 'оригинальн', 'способ', 'готов', 'экзамен', 'операц', 'предотвраща', 'ограблен', 'век', 'котор', 'идет', 'знаменит', 'тройк', 'балбес', 'трус', 'бывал']"
15,Престиж ,Роберт и Альфред — фокусники-иллюзионисты; которые на рубеже XIX и XX веков соперничали друг с другом в Лондоне. С годами их дружеская конкуренция на профессиональной почве перерастает в настоящую войну.Они готовы на все; чтобы выведать друг у друга секреты фантастических трюков и сорвать их исполнение. Непримиримая вражда; вспыхнувшая между ними; начинает угрожать жизни окружающих их людей…,"['роберт', 'альфред', 'фокусник', 'иллюзионист', 'рубеж', 'xix', 'век', 'сопернича', 'друг', 'друг', 'лондон', 'год', 'дружеск', 'конкуренц', 'профессиональн', 'почв', 'перераста', 'настоя', 'войн', 'готов', 'выведа', 'друг', 'друг', 'секрет', 'фантастическ', 'трюк', 'сорва', 'исполнен', 'непримирим', 'вражд', 'вспыхнувш', 'начина', 'угрожа', 'жизн', 'окружа', 'люд']"
16,Игры разума ,От всемирной известности до греховных глубин — все это познал на своей шкуре Джон Форбс Нэш-младший. Математический гений; он на заре своей карьеры сделал титаническую работу в области теории игр; которая перевернула этот раздел математики и практически принесла ему международную известность.Однако буквально в то же время заносчивый и пользующийся успехом у женщин Нэш получает удар судьбы; который переворачивает уже его собственную жизнь.,"['всемирн', 'известн', 'греховн', 'глубин', 'позна', 'шкур', 'джон', 'форбс', 'нэш', 'младш', 'математическ', 'ген', 'зар', 'карьер', 'сдела', 'титаническ', 'работ', 'област', 'теор', 'игр', 'перевернул', 'раздел', 'математик', 'практическ', 'принесл', 'международн', 'известн', 'буквальн', 'заносчив', 'польз', 'успех', 'женщин', 'нэш', 'получа', 'удар', 'судьб', 'переворачива', 'собствен']"
